Year	Reciever	Grant size (DKK)	Description	Project Category	Location	Title
Year: 2024	Grantee: Gregor Jemec, Professor of Dermatology and Head of Research at Zealand University Hospital	Amount: DKK 5,000,000	"Gregor Jemec is Professor of Dermatology and Head of Research at Zealand University Hospital.
He receives the LEO Foundation 40th Anniversary Prize for his extraordinary contribution to skin research – especially for his pioneering and persistent work with the chronic skin disease hidradenitis suppurativa (HS).
Gregor Jemec has been researching the skin and its diseases for the past 30 years and is one of Denmark’s most cited skin researchers. He is the author of over 800 publications and one of the world’s leading experts on HS, a skin condition that causes painful boils. Research estimates that one to four percent of the world’s population suffers from HS.
Learn more"	Grant category: Standalone grants	Geography: Denmark	The LEO Foundation 40th Anniversary Prize
Year: 2024	Grantee: Claire Higgins, Reader, Department of Bioengineering, Imperial College London, UK	Amount: USD 100,000	"Dr. Claire Higgins, is a Reader in the Department of Bioengineering at Imperial College London in the UK,
She receives the award in support of her impressive academic achievements and her remarkable leadership within her research group and to future generations of skin scientists. Her research aims to achieve scarless wound healing in human skin by studying the human hair follicle and understanding how it can be used as a model for skin healing.
Learn more"	Grant category: LEO Foundation Awards	Geography: United Kingdom	The LEO Foundation Award 2024 – Region EMEA
Year: 2024	Grantee: The University of Copenhagen and the University of Southern Denmark	Amount: DKK 30,000,000	"Center for Pharmaceutical Data Science Education is funded by the LEO Foundation, the Novo Nordisk Foundation and the Lundbeck Foundation with a total of DKK 123 million over a six-year period.
The new center merges two fields of study – the pharmaceutical sciences and data science – and will ensure the students’ qualifications in data science by upgrading relevant compulsory bachelor’s and master’s courses. Artificial intelligence, machine learning and the use of big data open a huge area of knowledge, new data sources and methods, which should be integrated in the best possible way in the pharmaceutical sciences education."	Grant category: Standalone grants	Geography: Denmark	Center for Pharmaceutical Data Science Education
Year: 2024	Grantee: Dashun Wang, Professor, Kellogg School of Management, Northwestern University	Amount: DKK 500,000	"This interdisciplinary event will convene leading experts in the field of science of science and innovation, aiming to provide a multi-channel platform that brings together both producers (scientists from industry and academia) and consumers (policymakers, publishers, funders, administrators, etc.) of the field.
Read more"	Grant category: Standalone grants	Geography: USA	4th annual International Conference on the Science of Science and Innovation (ICSSI)
Year: 2024	Grantee: Oregon Health and Science University	Amount: DKK 170,783	"The goal of the 71st Annual Montagna Symposium, Skin of Color Dermatology: The Interaction of Science & Society, is to promote practicing clinicians, residents, trainees, basic and translational researchers who are underrepresented in science and medicine, assembling leading scientists and clinicians engaged in research and treatment of diseases that disproportionately affect skin of color to share knowledge and foster collaborations.
The event will take place on 17-21 October 2024 in Washington, USA and aim to enable interaction between new and established scientists and dermatologists who work collectively to advance the field of skin research. The format will include short talks organized in sessions by topic, with time for questions and discussion. Young investigators get the opportunity to interact with experienced researchers and clinicians in their fields both formally and informally throughout the meeting, and the meeting provides participants with a springboard for new research activities or clinical practices.
Read more."	Grant category: Research Networking	Geography: USA	71st Annual Montagna Symposium: Skin of color Dermatology: The Intersection of Science and Society
Year: 2024	Grantee: Maastricht University Medical Center+	Amount: DKK 400,000	"The Symposium on Epidermal Differentiation Disorders (EDD) aims to expand the network of experts within EDD by involving and stimulating the future generations of researchers, clinicians, patient organizations, and industry. Organized by leading EDD experts, the event will bring together these stakeholders from diverse backgrounds to brainstorm, promote collaborative research, and design new trials.
EDD are a group of rare hereditary skin conditions characterized by skin thickening, scaling, and redness caused by pathogenic variants in the involved genes. EDD, which include ichthyosis and palmoplantar keratoderma, may affect only skin and related structures (hair, nails) or also other tissues in syndromic subtypes (for example, the brain, heart, hair or eyes). No cure is available, and treatments are limited and not effective enough. Because EDD can severely affect quality of life, the unmet need is high, and an improved understanding of its basis will make it easier to develop treatments that target the causes of disease.
The two-day symposium – currently scheduled for 15-16 September 2025 near Paris, France – will review updates on classification of EDD, clinical and genetic discoveries, novel targeted treatments, patient perspectives, and research. In addition to scientific sessions, the symposium emphasizes collaboration and networking opportunities. Panel discussions and a dedicated session for young researchers will encourage knowledge exchange and exploration of innovative approaches.
Read more."	Grant category: Research Networking	Geography: Netherlands	Symposium on Epidermal Differentiation Disorders
Year: 2024	Grantee: Ole Pedersen, Chief physician , Professor, Zealand University Hospital, Køge	Amount: DKK 2,715,598	"Ole Pedersen’s project aims to determine the genetic basis of rosacea and the causal connection between rosacea and its comorbidities.
Rosacea is a common chronic inflammatory skin disease of the face, which may manifest as a bulbous nose, central erythema, flushing, inflammatory papules/pustules, or broken vessels in addition to diverse eye involvement. Severe rosacea has a large impact on the patients’ quality of life, social and psychological well-being and has been linked to many systemic comorbidities including cardiovascular, psychiatric, neurological, and cancer diseases.
Ole Pedersen’s project aims to identify the genetic pathways of rosacea and determine the causal connection and modifiable risk factors to previously reported systemic comorbidities. He has recently developed a rosacea classification tool and applied it to a deep phenotyped cohort of ~55,000 Danes allowing for detailed analysis of association between rosacea, risk factors and co-morbidities. In addition, Ole Pedersen has facilitated genotyping of 500,000 Danes that can be used for genome wide association study meta-analysis with other genetic cohorts from Iceland, Finland, UK and USA to perform the so far largest genetic study on rosacea. Based on this analysis, his project will determine the genetic correlations and perform Mendelian randomization analysis of the causation between rosacea and comorbidities.
Ole Pedersen’s project may provide new understanding of disease pathogenesis and the link to systemic comorbidities, paving the way for developing new treatments and early targeted interventions."	Grant category: Research Grants in open competition	Geography: Denmark	Epidemiology and genetics of rosacea and co-morbidities
Year: 2024	Grantee: Xiaoyang Wu, Associate Professor, University of Chicago	Amount: DKK 4,000,000	"Xiaoyang Wu’s project aims to engineer self-amplifying RNA vector as a platform for gene therapy of recessive X-linked ichthyosis, with potential for treatment of other skin diseases.
Skin ichthyoses are a group of heterogeneous genetic diseases that are characterized by hyperkeratosis, localized or generalized scaling, and often associated with xerosis, hypohidrosis, erythroderma, and recurrent infections. So far, mutations in more than 50 genes have been shown to cause ichthyosis, which affect a variety of different cellular processes, ranging from DNA repair, lipid biosynthesis, cell adhesion, and skin differentiation. Recessive X-linked ichthyosis (RXLI) is the second most common form of inherited ichthyosis. RXLI is caused by mutations in the STS gene on the X chromosome, which encodes microsomal steroid sulfatase. The skin abnormalities of RXLI are caused by the impact of excess cholesterol sulfate, which affects lipid synthesis, organization of the lamellar lipids that provides the skin permeability barrier, corneodesmosome proteolysis, and epidermal differentiation.
As a genetic disorder, RXLI is a life-long condition that can significantly affect domestic life and cause psychological problems for the patients. More effective treatment beyond current symptomatic management is urgently needed. Xiaoyang Wu’s project will explore the possibility that engineered self-amplifying RNA vector can serve as a novel platform for gene therapy of RXLI.
Xiaoyang Wu’s project may serve as proof-of-concept for a novel paradigm for the treatment of patients with genetic skin disorders."	Grant category: Research Grants in open competition	Geography: USA	Development of novel RNA replicon vectors for treatment of skin genetic disorders
Year: 2024	Grantee: Rebecca Deprez-Poulain, Professor, Institut Pasteur de Lille	Amount: DKK 3,190,714	"Rebecca Deprez-Poulain’s project aims to investigate the therapeutic potential of ERAP1 and ERAP2 inhibitors for the treatment of psoriasis.
Psoriasis is caused by the erroneous recognition by T-cells of the immune system of self-peptides called antigens presented at the cell surface by the HLA-C receptor. This results in destruction cells and subsequent chronic inflammation. ERAP enzymes, which are the main actors of antigen preparation within cells, influence the immune response, and genetic studies show that several ERAP variants predispose to psoriasis. Rebecca Deprez-Poulain has identified selective inhibitors of ERAP1 and ERAP2 which decrease antigen presentation and T-cell activation and show preliminary positive results in vivo. Her project will combine structural biology, medicinal chemistry, biochemistry, and cellular biology to optimize current compounds into potent and selective inhibitors targeting ERAP. It will assess their therapeutic potential in purposely designed transgenic mouse models containing human ERAP, as well as in patient cells.
Rebecca Deprez-Poulain’s project may define the optimal profile of an ERAP inhibitor as a pharmacological tool, providing a foundation for the exploration of ERAP roles and eventually an ERAP-based oral treatment for psoriasis."	Grant category: Research Grants in open competition	Geography: France	Inhibitors of ERAP1 or ERAP2 to modulate antigen processing towards new psoriasis treatment
Year: 2024	Grantee: Christoph Schlapbach, Associate Professor, Inselspital, Bern University Hospital, University of Bern	Amount: DKK 3,942,000	"Christoph Schlapbach’s project aims to elucidate the role of interleukin (IL-)18 in atopic dermatitis (AD), a prevalent, chronic skin disease with significant burden and unmet therapeutic needs.
IL-18 is linked to AD pathogenesis by multiple lines of evidence: IL-18 receptor (IL-18R) gene variants associate with AD susceptibility, IL-18 levels correlate with disease severity, and animal models of AD suggest a pro-inflammatory function of IL-18 in type 2 skin inflammation. Yet, the functional link between IL-18, considered a Th1-promoting cytokine, and AD, a Th2-driven disease, remains obscure. Christoph Schlapbach’s preliminary data now indicate that (i) there is a functional link between AD-associated IL18R gene variants and heightened Th2-cell responses, (ii) IL-18 can promote secretion of pathogenic cytokines in Th2 cells of AD patients, and (iii) skin explants from lesional AD skin can be used to model the effects of IL-18 in the complex environment of human skin.
Christoph Sclapbach’s project will leverage genotype-phenotype-function studies in a translational approach to dissect the mechanisms by which IL-18 influences Th2 cell-mediated inflammation in AD. Utilizing state-of-the-art methodology and functional validation experiments, the study aims to clarify IL-18’s role in AD pathogenesis to answer this long-standing conundrum in the fields of dermatology and immunology.
The results of Christoph Schlapbach’s project may provide a new understanding of IL-18’s role in AD, potentially enabling improved treatment."	Grant category: Research Grants in open competition	Geography: Switzerland	The IL-18 Conundrum: Investigating the role of IL-18 the pathogenesis of atopic dermatitis
Year: 2024	Grantee: Jeffrey Rasmussen, Assistant Professor, University of Washington	Amount: DKK 3,834,520	"Jeffrey Rasmussen’s project investigates the mechanisms governing Langerhans cells’ immune response in wound healing, particularly the role of the microtubule cytoskeleton.
Skin provides a robust and durable physical barrier essential for regulating hydration and repelling pathogens. Damage to skin must be rapidly resolved to maintain organ homeostasis. Epidermal-resident immune cells known as Langerhans cells use dendritic protrusions to dynamically surveil the skin microenvironment, which contains epithelial keratinocytes and somatosensory peripheral axons.
The mechanisms governing Langerhans cell dendrite dynamics and responses to tissue damage are not well understood. Jeffrey Rasmussen and his lab have developed a tractable system using adult zebrafish to study Langerhans cell dynamics. Initial studies using this system revealed several new discoveries, including: 1) that Langerhans cells are the primary phagocyte for degenerating somatosensory axons; 2) Langerhans cells undergo stereotyped responses to local and tissue-scale keratinocyte wounds; and 3) the actin regulator ROCK regulates key aspects of Langerhans cell wound responses. Despite advances in identifying mechanisms of actin function in Langerhans cells, roles for the microtubule cytoskeleton in Langerhans cell biology remain essentially unknown. In preliminary studies, Jeffrey Rasmussen has developed a novel transgenic reporter for microtubules in Langerhans cells and found that the microtubule cytoskeleton dynamically reorganizes during wound responses. His project aims to determine how the microtubule cytoskeleton contributes to the intracellular trafficking and dynamic wound responses of Langerhans cells.
The results of Jeffrey Rasmussen’s project could lead to new fundamental understandings of Langerhans cell biology and dynamics."	Grant category: Research Grants in open competition	Geography: USA	Control of Langerhans cell dynamics and function by the microtubule cytoskeleton
Year: 2024	Grantee: Maria Alcolea, Associate Professor, University of Cambridge	Amount: DKK 3,887,952	"Maria Alcolea’s project explores how the plasticity of skin cells is affected by aging. Maria Alcolea and her team will study the molecular pathways that modulate changes in cell behaviour throughout life. The ultimate aim is to identify new targets to improve tissue regeneration and delay the regenerative decline associated with human skin ageing.
The ability of epithelial cells to rewire their program of cell fate in response to tissue perturbations has emerged as a new paradigm in stem cell biology. This plasticity improves the efficiency of tissue repair by enabling differentiated/lineage committed cells to reacquire stem cell-like behavior in response to damage. However, despite obvious implications for skin regeneration, virtually nothing is known about how the plastic capacity of skin cells is affected by ageing, and whether this contributes to changes in the normal physiology of the epidermis at later stages in life.
Maria Alcolea’s project will investigate the impact of aging in skin cell fate plasticity by making use of a novel in vivo model that enables tracing the fate of epidermal cells from the earliest stages of commitment towards differentiation. Newly developed tools offers a unique opportunity to identify the mechanisms dictating epithelial cell fate plasticity and determine whether aged-associated changes in this process hold the key to understand why the regenerative capacity of our skin declines over time. She will combine the lab’s expertise in in vivo quantitative lineage tracing, single-cell RNA sequencing approaches, and mathematical network analysis. Observations made in in vivo mouse models will be compared to human skin using a novel 3D organ culture.
Maria Alcolea’s project may contribute significantly to the emerging field of epidermal cell plasticity and provide a benchmark for identifying potential targets to partially reduce/reverse skin ageing."	Grant category: Research Grants in open competition	Geography: United Kingdom	Impact of ageing on epidermal cell fate plasticity
Year: 2024	Grantee: Sophia Maschalidi, Assistant Professor, Universiteit Gent	Amount: DKK 3,986,871	"Sophia Maschalidi’s project explores the significance of enhancing efferocytosis – clearance of apoptotic cells by phagocytes – in skin injury repair, with the overall aim of accelerating wound closure.
The continual turnover of billions of cells in our bodies occurs as professional and non-professional phagocytes engulf cells dying via apoptosis. The efficiency of cell clearance or efferocytosis is remarkable and critical for homeostasis, minimizing inflammation and promoting repair. As the largest organ in our body, the skin acts as our first line of defense. Tissue repair after skin injury involves the clearance of apoptotic cells by phagocytes at the wound site as part of the process of resolving the inflammation and restoring the barrier. The importance of hastening barrier restoration is highlighted in chronic non-healing wounds, such as those associated with diabetes or in excess healing reactions after wounding leading to pathological scar tissue formation or fibrosis.
Sophia Maschalidi’s project aims to develop appropriate tools to enhance efferocytosis in vivo. Using novel techniques and sophisticated genetic mouse models, it will systematically address, for the first time, the importance of boosting efferocytosis during primary skin injury repair and in subsequent challenges. It will address how primary phagocytic experience shapes long-term changes on phagocytes and neighboring cells and whether this “efferocytic memory” shapes responses to secondary assaults.
Sophia Maschalidi’s project hopes to result in a fundamental understanding of the mechanisms and potential in boosting efferocytosis for therapeutic benefit in cutaneous wound management."	Grant category: Research Grants in open competition	Geography: Belgium	Boosting the phagocytic clearance of apoptotic cells for better wound healing during primary skin injury repair and upon secondary assaults
Year: 2024	Grantee: Yossi Buganim, Associate Professor, The Hebrew University of Jerusalem	Amount: DKK 3,996,300	"Yossi Buganim’s project investigates the mechanisms behind fibroblast dysfunction in aging skin and develops a novel technology for rejuvenating aged fibroblast to improve wound healing.
Fibroblasts are pivotal in orchestrating skin wound healing processes, contributing to fibrin clot breakdown, extracellular matrix synthesis, collagen formation, and wound contraction. These multifaceted roles highlight their significance in skin repair following injuries, which trigger a cascade of synchronized healing mechanisms. Despite their crucial functions, aging impairs fibroblast functionality, leading to prolonged and impaired wound healing processes, increasing susceptibility to chronic wounds and scarring. Elderly individuals experience delayed wound healing, partly attributed to reduced cell division of the aged fibroblasts and diminished fat cell production and attraction to the wound area, resulting in thinning skin and heightened vulnerability to injuries. Moreover, aging cells exhibit slower regeneration, compromised bacterial defense mechanisms, and increased inflammation, further hindering the healing process.
Addressing these age-related impairments is imperative for advancing wound care strategies. Yossi Bunganim’s project seeks to elucidate the molecular mechanisms underlying fibroblast dysfunction in aging and leverage novel partial reprogramming technology to rejuvenate aged fibroblasts, enhancing wound healing outcomes.
Yossi Bunganim’s project aims to develop innovative interventions to mitigate the burden of chronic wounds and scarring in the aging population, ultimately improving overall quality of life and healthcare outcomes."	Grant category: Research Grants in open competition	Geography: Israel	Harnessing Novel Partial Reprogramming Technology to Revitalize Aging Skin Fibroblasts for Enhanced Wound Healing
Year: 2024	Grantee: Nicolas Manel, Research Director, Institute Curie	Amount: DKK 2,723,700	"Nicolas Manel’s project explores the mechanisms of skin aging and immunity dysfunction, with a focus on establishing a novel model for investigating the role of the nuclear envelope in skin aging.
Genome instability is considered a central mechanism of aging. The nuclear envelope is essential for genome stability. Nicolas Manel’s laboratory recently reported that in mice deficient for a protein of the nuclear envelope in the immune system, alveolar macrophages, but not other lung immune cells, acquire aging hallmarks and decline in number, as observed in chronological aging. This established that deficiency of a nuclear envelope component can represent a cell-intrinsic model of accelerated aging in specific immune cell types. In preliminary results, further explorations revealed that subsets of skin immune cells are also decreased in a mouse model of nuclear envelope deficiency. Interestingly, the same skin immune cells are decreased in the aged skin of humans and mice. Nicolas Manel’s project will test the hypothesis that loss of nuclear envelope integrity is a mechanism of aging in these skin immune cells. It aims to define the mechanisms leading to skin immune cell depletion, the impact on the immune cell homeostasis in the skin, and the pathophysiological consequences of such depletion in skin immunity against age-related pathologies.
The results of the project have the potential to reveal new fundamental pathways in the aging of skin immunity and its impact on the health of aged individuals."	Grant category: Research Grants in open competition	Geography: France	A novel model to study aging of skin immunity
Year: 2024	Grantee: Eran Elinav, Head of Department, Weizmann Institute of Science	Amount: DKK 4,000,000	"Eran Elinav’s project explores the role of circadian rhythm in regulating host-microbiome interactions in the skin, and the impact of abnormal circadian rhythm on the microbiota of the gut, with a potential link to skin inflammation, psoriasis in particular.
While the exact cause of psoriasis remains elusive, it is believed to stem from a combination of genetic and environmental factors, including dietary and biological clock-related influences. The mechanism by which these factors impact psoriasis is closely tied to the circadian rhythm, as evidenced by the abnormal circadian rhythms observed in psoriasis patients. In recent years, the pivotal role of the microbiota – the trillions of indigenous microorganisms inhabiting the human body – has come to the forefront. Eran Elinav’s group has recently uncovered that circadian disruption can exacerbate inflammatory diseases by disrupting the diurnal oscillations of the gut microbiota. His project explores how the circadian clock may also orchestrate fluctuations in the dermal microbiome, which could be crucial in understanding skin diseases such as psoriasis.
Eran Elinav’s project aims to identify novel host-microbiome interactions in the skin and generate a novel framework for microbiome-based interventions for psoriasis."	Grant category: Research Grants in open competition	Geography: Israel	Decoding circadian host-microbiome skin interactions in health and psoriasis
